{
  "cve_id": "CVE-2023-44487",
  "affected_component": "nginx",
  "affected_version_range": "<= 1.24.0",
  "cvss_score": 7.5,
  "cvss_vector": "CVSS:3.1/AV:N/AC:L/PR:N/UI:N/S:U/C:N/I:N/A:H",
  "cwe_id": "CWE-400",
  "poc_available": true,
  "source_name": "osint-analyst",
  "validation_status": "version_match",
  "notes": "HTTP/2 rapid reset attack; affects nginx versions <= 1.24.0",
  "provenance": {
    "agent_name": "osint-analyst",
    "artifact_ref": "scans/whatweb.txt:12"
  }
}
